{
  "id": "plugin:buildin-security_compliance-context_audit_trail",
  "type": "plugin",
  "name": "Context Audit Trail",
  "version": "1.0.0",
  "author": "Anthropic PBC",
  "license": "Apache-2.0",
  "license_url": "https://github.com/CorvinLabs/CorvinOS/blob/main/LICENSE",
  "tier": "buildin",
  "category": "security_compliance",
  "description": "Detailed audit trail for context engineering (preservation, truncation, re-injection)",
  "boot_layer": "bundled",
  "security_audit": {
    "last_audit_date": "2026-09-05",
    "auditor": "CorvinOS Security Team",
    "findings": 0,
    "findings_by_severity": {
      "critical": 0,
      "high": 0,
      "medium": 0,
      "low": 0
    },
    "audit_report_url": "https://github.com/CorvinLabs/CorvinOS/security/advisories"
  },
  "distribution": {
    "supports_source": true,
    "supports_wheel": false,
    "source_url": "https://github.com/CorvinLabs/Corvin-Marketplace/tree/main/plugins/buildin/security_compliance/context_audit_trail/src"
  },
  "tags": [
    "compliance"
  ]
}
