{
  "id": "memory/cel_session_memory",
  "type": "plugin",
  "name": "CEL Session Memory",
  "version": "1.0.0",
  "author": "Anthropic PBC",
  "license": "Apache-2.0",
  "license_url": "https://github.com/anthropics/CorvinOS/blob/main/LICENSE",
  "tier": "buildin",
  "category": "memory",
  "description": "L28 session memory provider",
  "readme_url": "https://github.com/anthropics/CorvinOS/blob/main/docs/plugin-developer-guide.md#cel_session_memory",
  "distribution": {
    "supports_source": true,
    "supports_wheel": false,
    "source_url": "https://github.com/anthropics/CorvinOS/tree/main/core/plugins/corvin_plugins/providers/cel_session_memory.py"
  },
  "dependencies": [],
  "requires_version": ">=1.0.0",
  "boot_layer": "bundled",
  "sla_level": "buildin",
  "security_audit": {
    "last_audit_date": "2026-08-31",
    "auditor": "CorvinOS Security Team",
    "findings": 0,
    "findings_by_severity": {
      "critical": 0,
      "high": 0,
      "medium": 0,
      "low": 0
    },
    "audit_report_url": "https://github.com/anthropics/CorvinOS/security/advisories"
  },
  "maintainer_url": "mailto:plugins@anthropic.com",
  "tags": [
    "memory"
  ],
  "entry_point": "core.plugins.buildin.memory.cel_session_memory.CelSessionMemory",
  "origin": "builtin"
}
