{
  "id": "plugin:buildin-memory-brain_learning_tracker",
  "type": "plugin",
  "name": "Brain Learning Tracker",
  "version": "1.0.0",
  "author": "Anthropic PBC",
  "license": "Apache-2.0",
  "tier": "buildin",
  "category": "memory",
  "description": "Track Brain subsystem learning and preference evolution over time",
  "boot_layer": "bundled",
  "distribution": {
    "supports_source": true,
    "supports_wheel": true,
    "source_url": "https://github.com/CorvinLabs/Corvin-Marketplace/tree/main/plugins/buildin/memory/brain_learning_tracker/src",
    "wheel_url": "https://github.com/CorvinLabs/Corvin-Marketplace/releases/download/v1.1.0/brain_learning_tracker-1.0.0-py3-none-any.whl"
  },
  "tags": [
    "memory"
  ]
}