{
  "id": "security_compliance/secret_scanner",
  "type": "plugin",
  "name": "Secret Scanner",
  "version": "0.1.0",
  "author": "Anthropic PBC",
  "license": "Apache-2.0",
  "license_url": "https://github.com/CorvinLabs/Corvin-Marketplace/blob/main/LICENSE",
  "tier": "buildin",
  "category": "security_compliance",
  "description": "Detect leaked secrets",
  "readme_url": "https://github.com/CorvinLabs/Corvin-Marketplace/blob/main/plugins/buildin/security_compliance/secret_scanner/README.md",
  "distribution": {
    "supports_source": true,
    "supports_wheel": false,
    "source_url": "https://github.com/CorvinLabs/Corvin-Marketplace/tree/main/plugins/buildin/security_compliance/secret_scanner"
  },
  "dependencies": [],
  "requires_version": ">=1.0.0",
  "boot_layer": "installed",
  "sla_level": "buildin",
  "security_audit": {
    "audited": false
  },
  "maintainer_url": "mailto:plugins@anthropic.com",
  "tags": [
    "security",
    "compliance"
  ],
  "entry_point": "core.plugins.buildin.security_compliance.secret_scanner.SecretScanner",
  "origin": "builtin"
}
