{
  "id": "plugin:buildin-security_compliance-audit_chain",
  "type": "plugin",
  "name": "Audit Chain",
  "version": "1.0.0",
  "author": "Anthropic PBC",
  "license": "Apache-2.0",
  "license_url": "https://github.com/anthropics/CorvinOS/blob/main/LICENSE",
  "tier": "buildin",
  "category": "security_compliance",
  "description": "L16 hash-chained audit logging",
  "readme_url": "https://github.com/anthropics/CorvinOS/blob/main/docs/plugin-developer-guide.md#audit_chain",
  "distribution": {
    "supports_source": true,
    "supports_wheel": true,
    "source_url": "https://github.com/anthropics/CorvinOS/tree/main/core/plugins/corvin_plugins/providers/audit_chain.py",
    "wheel_url": "https://github.com/CorvinLabs/Corvin-Marketplace/releases/download/v1.0.0/security_compliance-audit_chain-1.0.0-py3-none-any.whl",
    "wheel_signature_url": "https://releases.corvinlabs.com/plugins/buildin-security_compliance-audit_chain-1.0.0-py3-none-any.whl.asc",
    "wheel_checksum": "sha256:0000000000000000000000000000000000000000000000000000000000000000"
  },
  "dependencies": [],
  "requires_version": ">=1.0.0",
  "boot_layer": "bundled",
  "sla_level": "buildin",
  "security_audit": {
    "last_audit_date": "2026-08-31",
    "auditor": "CorvinOS Security Team",
    "findings": 0,
    "findings_by_severity": {
      "critical": 0,
      "high": 0,
      "medium": 0,
      "low": 0
    },
    "audit_report_url": "https://github.com/anthropics/CorvinOS/security/advisories"
  },
  "maintainer_url": "mailto:plugins@anthropic.com",
  "tags": [
    "security",
    "compliance"
  ]
}