{
  "id": "plugin:buildin-data_processing-stt_provider",
  "type": "plugin",
  "name": "Speech-to-Text Provider",
  "version": "1.0.0",
  "author": "Anthropic PBC",
  "license": "Apache-2.0",
  "license_url": "https://github.com/anthropics/CorvinOS/blob/main/LICENSE",
  "tier": "buildin",
  "category": "data_processing",
  "description": "Speech transcription with metadata-only audit. GDPR Art. 5 compliance.",
  "readme_url": "https://github.com/anthropics/CorvinOS/blob/main/docs/plugin-developer-guide.md#stt_provider",
  "distribution": {
    "supports_source": true,
    "supports_wheel": true,
    "source_url": "https://github.com/anthropics/CorvinOS/tree/main/core/plugins/corvin_plugins/providers/stt_provider.py",
    "wheel_url": "https://github.com/CorvinLabs/Corvin-Marketplace/releases/download/v1.0.0/data_processing-stt_provider-1.0.0-py3-none-any.whl",
    "wheel_signature_url": "https://releases.corvinlabs.com/plugins/buildin-data_processing-stt_provider-1.0.0-py3-none-any.whl.asc",
    "wheel_checksum": "sha256:0000000000000000000000000000000000000000000000000000000000000000"
  },
  "dependencies": [],
  "requires_version": ">=1.0.0",
  "boot_layer": "bundled",
  "sla_level": "buildin",
  "security_audit": {
    "last_audit_date": "2026-08-31",
    "auditor": "CorvinOS Security Team",
    "findings": 0,
    "findings_by_severity": {
      "critical": 0,
      "high": 0,
      "medium": 0,
      "low": 0
    },
    "audit_report_url": "https://github.com/anthropics/CorvinOS/security/advisories"
  },
  "maintainer_url": "mailto:plugins@anthropic.com",
  "tags": [
    "ai-learning",
    "compliance"
  ],
  "last_updated": "2026-08-31T18:29:14.520425Z"
}