{
  "id": "plugin:buildin-observability-diagnostics_dashboard",
  "type": "plugin",
  "name": "Diagnostics Dashboard",
  "version": "1.0.0",
  "author": "Anthropic PBC",
  "license": "Apache-2.0",
  "license_url": "https://github.com/anthropics/CorvinOS/blob/main/LICENSE",
  "tier": "buildin",
  "category": "observability",
  "description": "L36 system diagnostics",
  "readme_url": "https://github.com/anthropics/CorvinOS/blob/main/docs/plugin-developer-guide.md#diagnostics_dashboard",
  "distribution": {
    "supports_source": true,
    "supports_wheel": false,
    "source_url": "https://github.com/anthropics/CorvinOS/tree/main/core/plugins/corvin_plugins/providers/diagnostics_dashboard.py"
  },
  "dependencies": [],
  "requires_version": ">=1.0.0",
  "boot_layer": "bundled",
  "sla_level": "buildin",
  "security_audit": {
    "last_audit_date": "2026-08-31",
    "auditor": "CorvinOS Security Team",
    "findings": 0,
    "findings_by_severity": {
      "critical": 0,
      "high": 0,
      "medium": 0,
      "low": 0
    },
    "audit_report_url": "https://github.com/anthropics/CorvinOS/security/advisories"
  },
  "maintainer_url": "mailto:plugins@anthropic.com",
  "tags": [
    "observability"
  ]
}
