{
  "id": "integration/hook_system",
  "type": "plugin",
  "name": "Hook System",
  "version": "0.1.0",
  "author": "Anthropic PBC",
  "license": "Apache-2.0",
  "license_url": "https://github.com/CorvinLabs/Corvin-Marketplace/blob/main/LICENSE",
  "tier": "buildin",
  "category": "integration",
  "description": "Hook registry and dispatch",
  "readme_url": "https://github.com/CorvinLabs/Corvin-Marketplace/blob/main/plugins/buildin/integration/hook_system/README.md",
  "distribution": {
    "supports_source": true,
    "supports_wheel": false,
    "source_url": "https://github.com/CorvinLabs/Corvin-Marketplace/tree/main/plugins/buildin/integration/hook_system"
  },
  "dependencies": [],
  "requires_version": ">=1.0.0",
  "boot_layer": "installed",
  "sla_level": "buildin",
  "security_audit": {
    "audited": false
  },
  "maintainer_url": "mailto:plugins@anthropic.com",
  "tags": [
    "integration"
  ],
  "entry_point": "core.plugins.buildin.integration.hook_system.HookSystem",
  "origin": "builtin"
}
