{
  "id": "observability/brain_diagnostics",
  "type": "plugin",
  "name": "Brain Diagnostics Dashboard",
  "version": "1.0.0",
  "author": "Anthropic PBC",
  "license": "Apache-2.0",
  "license_url": "https://github.com/CorvinLabs/CorvinOS/blob/main/LICENSE",
  "tier": "buildin",
  "category": "observability",
  "description": "Real-time diagnostics for Brain 13 subsystems (execution context, autonomy, etc.)",
  "boot_layer": "bundled",
  "security_audit": {
    "last_audit_date": "2026-09-05",
    "auditor": "CorvinOS Security Team",
    "findings": 0,
    "findings_by_severity": {
      "critical": 0,
      "high": 0,
      "medium": 0,
      "low": 0
    },
    "audit_report_url": "https://github.com/CorvinLabs/CorvinOS/security/advisories"
  },
  "distribution": {
    "supports_source": true,
    "supports_wheel": false,
    "source_url": "https://github.com/CorvinLabs/Corvin-Marketplace/tree/main/plugins/buildin/observability/brain_diagnostics/src"
  },
  "tags": [
    "observability"
  ],
  "entry_point": "core.plugins.buildin.observability.brain_diagnostics.BrainDiagnostics",
  "origin": "builtin"
}
